{
  "id": "b29c3be1-6d6d-5955-94f6-31f20761d8a4",
  "offering_id": "83a6036e-bd88-5cb8-aa8f-676521050f68",
  "title": "Regalia Gold airmiles conversion route",
  "benefit_type": "conversion",
  "category": "conversion",
  "allowance": {
    "maximum_airmiles_per_reward_point": "0.5",
    "partner_and_transfer_terms": "not identified in the reviewed issuer material"
  },
  "eligibility": [],
  "conditions": [],
  "exclusions": [],
  "redemption_steps": [],
  "provider": null,
  "effective_from": null,
  "effective_to": null,
  "end_date_known": false,
  "source_url": "https://www.hdfc.bank.in/credit-cards/regalia-gold-credit-card",
  "source_policy_class": "issuer_document",
  "content_sha256": "06a79a11c0db2f8b372be5eea6e4f0147297ccb1773acd5895cf5a181eb99160",
  "retrieved_at": "2026-08-09T18:35:41Z",
  "state": "check_before_use",
  "provenance": [
    {
      "source_url": "https://www.hdfc.bank.in/credit-cards/regalia-gold-credit-card",
      "source_policy_class": "issuer_document",
      "content_sha256": "06a79a11c0db2f8b372be5eea6e4f0147297ccb1773acd5895cf5a181eb99160",
      "retrieved_at": "2026-08-09T18:35:41Z",
      "id": "f21ca056-6d72-5b33-8d74-0e6e0fa8bfc8",
      "confidence": "high"
    }
  ],
  "quantities": []
}
