{
  "id": "53af48e3-6ba8-5c90-a2ad-2d982452e703",
  "offering_id": "c2a6190e-7462-5b76-97ce-3b994c26d351",
  "title": "DBS Treasures Visa Infinite zero foreign-exchange markup",
  "benefit_type": "other",
  "category": "foreign_exchange",
  "allowance": {
    "foreign_exchange_markup_percent": 0
  },
  "eligibility": [],
  "conditions": [],
  "exclusions": [],
  "redemption_steps": [],
  "provider": null,
  "effective_from": null,
  "effective_to": null,
  "end_date_known": false,
  "source_url": "https://www.dbs.bank.in/in/treasures/deposits/your-cards/infinite-debit-card",
  "source_policy_class": "issuer_document",
  "content_sha256": "a9009d64b710245a68781e3ca3e86ede9e55b9b8bcaf930f28874e6faea9bdb6",
  "retrieved_at": "2026-08-10T00:00:00Z",
  "state": "check_before_use",
  "provenance": [
    {
      "source_url": "https://www.dbs.bank.in/in/treasures/deposits/your-cards/infinite-debit-card",
      "source_policy_class": "issuer_document",
      "content_sha256": "a9009d64b710245a68781e3ca3e86ede9e55b9b8bcaf930f28874e6faea9bdb6",
      "retrieved_at": "2026-08-10T00:00:00Z",
      "id": "43765318-1e53-51b1-802d-8ce872e1836d",
      "source_observation_id": "6cddecd3-e0c8-5889-ae20-9ba24f2a9930",
      "hash_kind": "snapshot_manifest_sha256",
      "confidence": "low"
    }
  ]
}
