{
  "id": "16f362ff-1735-573d-ad5b-1e70090a76f8",
  "offering_id": "83a6036e-bd88-5cb8-aa8f-676521050f68",
  "title": "Regalia Gold reward-point travel and cashback redemption limits",
  "benefit_type": "conversion",
  "category": "conversion",
  "allowance": {
    "travel_booking_redemption_percent_cap": 70,
    "monthly_flight_hotel_points_cap": 50000,
    "monthly_statement_balance_points_cap": 50000
  },
  "eligibility": [],
  "conditions": [],
  "exclusions": [],
  "redemption_steps": [],
  "provider": null,
  "effective_from": "2026-05-15",
  "effective_to": null,
  "end_date_known": false,
  "source_url": "https://www.hdfc.bank.in/credit-cards/regalia-gold-credit-card",
  "source_policy_class": "issuer_document",
  "content_sha256": "06a79a11c0db2f8b372be5eea6e4f0147297ccb1773acd5895cf5a181eb99160",
  "retrieved_at": "2026-08-09T18:35:41Z",
  "state": "sources_differ",
  "provenance": [
    {
      "source_url": "https://www.hdfc.bank.in/content/dam/hdfcbankpws/in/en/personal-banking/discover-products/cards/credit-cards/regalia-gold-credit-card/pdfs/regalia-gold-credit-card-reward-points-t-and-cs.pdf",
      "source_policy_class": "issuer_document",
      "content_sha256": "5586294b59cd369eb9012e4b93f4f066dc0ca5a5208d4484a2b32ee9067ed9db",
      "retrieved_at": "2026-08-09T18:35:43Z",
      "id": "b8a3c2ee-c37b-537d-8b85-f14c8a1238d2",
      "confidence": "high",
      "effective_from": "2026-05-15"
    },
    {
      "source_url": "https://www.hdfc.bank.in/credit-cards/regalia-gold-credit-card",
      "source_policy_class": "issuer_document",
      "content_sha256": "06a79a11c0db2f8b372be5eea6e4f0147297ccb1773acd5895cf5a181eb99160",
      "retrieved_at": "2026-08-09T18:35:41Z",
      "id": "f21ca056-6d72-5b33-8d74-0e6e0fa8bfc8",
      "confidence": "high"
    }
  ]
}
